;Command;Desc;Options
0;ACRO_LOCKING;Enable attitude locking when sticks are released;0:Disabled,1:Enabled
1;ACRO_PITCH_RATE;The maximum pitch rate at full stick deflection in ACRO mode;
2;ACRO_ROLL_RATE;The maximum roll rate at full stick deflection in ACRO mode;
3;ACRO_YAW_RATE;The maximum yaw rate at full stick deflection in QACRO mode;
4;ADSB_TYPE;The maximum yaw rate at full stick deflection in QACRO mode;
5;AFS_ENABLE;This enables the advanced failsafe system. If this is set to zero (disable) then all the other AFS options have no effect;
6;AHRS_COMP_BETA;This controls the time constant for the cross-over frequency used to fuse AHRS (airspeed and heading) and GPS data to estimate ground velocity. Time constant is 0.1/beta. A larger time constant will use GPS data less and a small time constant will use air data less.;
7;AHRS_EKF_TYPE;This controls which NavEKF Kalman filter version is used for attitude and position estimation;0:Disabled,2:Enable EKF2,3:Enable EKF3
8;AHRS_GPS_GAIN;This controls how much to use the GPS to correct the attitude. This should never be set to zero for a plane as it would result in the plane losing control in turns. For a plane please use the default value of 1.0.;
9;AHRS_GPS_MINSATS;Minimum number of satellites visible to use GPS for velocity based corrections attitude correction. This defaults to 6, which is about the point at which the velocity numbers from a GPS become too unreliable for accurate correction of the accelerometers.;
10;AHRS_GPS_USE;This controls whether to use dead-reckoning or GPS based navigation. If set to 0 then the GPS won't be used for navigation, and only dead reckoning will be used. A value of zero should never be used for normal flight. Currently this affects only the DCM-based AHRS: the EKF uses GPS whenever it is available.;0:Disabled,1:Enabled
11;AHRS_ORIENTATION;Autopilot mounting position roll offset. Positive values = roll right, negative values = roll left. This parameter is only used when AHRS_ORIENTATION is set to CUSTOM.;
12;AHRS_RP_P;This controls how fast the accelerometers correct the attitude;
13;AHRS_TRIM_X;Compensates for the roll angle difference between the control board and the frame. Positive values make the vehicle roll right.;
14;AHRS_TRIM_Y;Compensates for the pitch angle difference between the control board and the frame. Positive values make the vehicle pitch up/back.;
15;AHRS_TRIM_Z;Not Used;
16;AHRS_WIND_MAX;This sets the maximum allowable difference between ground speed and airspeed. This allows the plane to cope with a failing airspeed sensor. A value of zero means to use the airspeed as is.;
17;AHRS_YAW_P;This controls the weight the compass or GPS has on the heading. A higher value means the heading will track the yaw source (GPS or compass) more rapidly.;
18;ALT_HOLD_FBWCM;This is the minimum altitude in centimeters that FBWB and CRUISE modes will allow. If you attempt to descend below this altitude then the plane will level off. A value of zero means no limit.;
19;ALT_HOLD_RTL;Target altitude above home for RTL mode. Maintains current altitude if set to -1. Rally point altitudes are used if plane does not return to home.;
20;ALT_OFFSET;altitude offset in meters added to barometric altitude. This is used to allow for automatic adjustment of the base barometric altitude by a ground station equipped with a barometer. The value is added to the barometric altitude read by the aircraft. It is automatically reset to 0 when the barometer is calibrated on each reboot or when a preflight calibration is performed.;
21;ARMING_ACCTHRESH;Accelerometer error threshold used to determine inconsistent accelerometers. Compares this error range to other accelerometers to detect a hardware or calibration error. Lower value means tighter check and harder to pass arming check. Not all accelerometers are created equal.;
22;ARMING_CHECK;Checks prior to arming motor. This is a bitmask of checks that will be performed before allowing arming. The default is no checks, allowing arming at any time. You can select whatever checks you prefer by adding together the values of each check type to set this parameter. For example, to only allow arming when you have GPS lock and no RC failsafe you would set ARMING_CHECK to 72. For most users it is recommended that you set this to 1 to enable all checks.;
23;ARMING_MIS_ITEMS;Bitmask of mission items that are required to be planned in order to arm the aircraft;
24;ARMING_OPTIONS;Bitmask of mission items that are required to be planned in order to arm the aircraft;
25;ARMING_REQUIRE;Arming disabled until some requirements are met. If 0, there are no requirements (arm immediately).  If 1, require rudder stick or GCS arming before arming motors and sends the minimum throttle PWM value to the throttle channel when disarmed.  If 2, require rudder stick or GCS arming and send 0 PWM to throttle channel when disarmed. See the ARMING_CHECK_* parameters to see what checks are done before arming. Note, if setting this parameter to 0 a reboot is required to arm the plane.  Also note, even with this parameter at 0, if ARMING_CHECK parameter is not also zero the plane may fail to arm throttle at boot due to a pre-arm check failure.;0:Disabled,1:THR_MIN PWM when disarmed,2:0 PWM when disarmed
26;ARMING_RUDDER;Allow arm/disarm by rudder input. When enabled arming can be done with right rudder, disarming with left rudder. Rudder arming only works in manual throttle modes with throttle at zero +- deadzone (RCx_DZ);0:Disabled,1:ArmingOnly,2:ArmOrDisarm
27;ARSPD2_TYPE;Type of 2nd airspeed sensor;0:None,1:I2C-MS4525D0,2:Analog,3:I2C-MS5525,4:I2C-MS5525 (0x76),5:I2C-MS5525 (0x77),6:I2C-SDP3X,7:I2C-DLVR-5in,8:UAVCAN,9:I2C-DLVR-10in,10:I2C-DLVR-20in,11:I2C-DLVR-30in,12:I2C-DLVR-60in
28;ARSPD_AUTOCAL;Enables automatic adjustment of ARSPD_RATIO during a calibration flight based on estimation of ground speed and true airspeed. New ratio saved every 2 minutes if change is &gt. 5%. Should not be left enabled.;
29;ARSPD_BUS;Bus number of the I2C bus where the airspeed sensor is connected;0:Bus0(internal),1:Bus1(external),2:Bus2(auxillary)
30;ARSPD_DEVID;Bus number of the I2C bus where the airspeed sensor is connected;0:Bus0(internal),1:Bus1(external),2:Bus2(auxillary)
31;ARSPD_FBW_MAX;Maximum airspeed demanded in automatic throttle modes. Should be set slightly less than level flight speed at THR_MAX and also at least 50% above ARSPD_FBW_MIN to allow for accurate TECS altitude control.;
32;ARSPD_FBW_MIN;;
33;ARSPD_OFFSET;Airspeed calibration offset;
34;ARSPD_OPTIONS;Bitmask of options to use with airspeed.;
35;ARSPD_PIN;The pin number that the airspeed sensor is connected to for analog sensors. Set to 15 on the Pixhawk for the analog airspeed port.;
36;ARSPD_PRIMARY;This selects which airspeed sensor will be the primary if multiple sensors are found;0:FirstSensor,1:2ndSensor
37;ARSPD_PSI_RANGE;This parameter allows you to to set the PSI (pounds per square inch) range for your sensor. You should not change this unless you examine the datasheet for your device;
38;ARSPD_RATIO;Bus number of the I2C bus where the airspeed sensor is connected;0:Bus0(internal),1:Bus1(external),2:Bus2(auxillary)
39;ARSPD_SKIP_CAL;This parameter allows you to skip airspeed offset calibration on startup, instead using the offset from the last calibration. This may be desirable if the offset variance between flights for your sensor is low and you want to avoid having to cover the pitot tube on each boot.;0:Disable,1:Enable
40;ARSPD_TUBE_ORDER;Changes the pitot tube order to specify the dynamic pressure side of the sensor. Accepts either if set to 2. Accepts only one side if set to 0 or 1 and can help detect excessive pressure on the static port without indicating positive airspeed.;
41;ARSPD_TYPE;Type of airspeed sensor;0:None,1:I2C-MS4525D0,2:Analog,3:I2C-MS5525,4:I2C-MS5525 (0x76),5:I2C-MS5525 (0x77),6:I2C-SDP3X,7:I2C-DLVR-5in,8:UAVCAN,9:I2C-DLVR-10in,10:I2C-DLVR-20in,11:I2C-DLVR-30in,12:I2C-DLVR-60in
42;ARSPD_USE;Enables airspeed use for automatic throttle modes and replaces control from THR_TRIM. Continues to display and log airspeed if set to 0. Uses airspeed for control if set to 1. Only uses airspeed when throttle = 0 if set to 2 (useful for gliders with airspeed sensors behind propellers).;0:DoNotUse,1:Use,2:UseWhenZeroThrottle
43;ARSPD_WIND_GATE;Enables airspeed use for automatic throttle modes and replaces control from THR_TRIM. Continues to display and log airspeed if set to 0. Uses airspeed for control if set to 1. Only uses airspeed when throttle = 0 if set to 2 (useful for gliders with airspeed sensors behind propellers).;0:DoNotUse,1:Use,2:UseWhenZeroThrottle
44;ARSPD_WIND_MAX;Enables airspeed use for automatic throttle modes and replaces control from THR_TRIM. Continues to display and log airspeed if set to 0. Uses airspeed for control if set to 1. Only uses airspeed when throttle = 0 if set to 2 (useful for gliders with airspeed sensors behind propellers).;0:DoNotUse,1:Use,2:UseWhenZeroThrottle
45;ARSPD_WIND_WARN;Enables airspeed use for automatic throttle modes and replaces control from THR_TRIM. Continues to display and log airspeed if set to 0. Uses airspeed for control if set to 1. Only uses airspeed when throttle = 0 if set to 2 (useful for gliders with airspeed sensors behind propellers).;0:DoNotUse,1:Use,2:UseWhenZeroThrottle
46;AUTOTUNE_LEVEL;Level of aggressiveness of pitch and roll PID gains. Lower values result in a 'softer' tune. Level 6 recommended for most planes.;
47;AVD_ENABLE;Enable Avoidance using ADSB;0:Disabled,1:Enabled
48;BARO1_DEVID;Enable Avoidance using ADSB;0:Disabled,1:Enabled
49;BARO1_GND_PRESS;Enable Avoidance using ADSB;0:Disabled,1:Enabled
50;BARO1_WCF_ENABLE;Enable Avoidance using ADSB;0:Disabled,1:Enabled
51;BARO2_DEVID;Enable Avoidance using ADSB;0:Disabled,1:Enabled
52;BARO2_GND_PRESS;Enable Avoidance using ADSB;0:Disabled,1:Enabled
53;BARO2_WCF_ENABLE;Enable Avoidance using ADSB;0:Disabled,1:Enabled
54;BARO3_DEVID;Enable Avoidance using ADSB;0:Disabled,1:Enabled
55;BARO3_GND_PRESS;Enable Avoidance using ADSB;0:Disabled,1:Enabled
56;BARO3_WCF_ENABLE;Enable Avoidance using ADSB;0:Disabled,1:Enabled
57;BARO_ALTERR_MAX;Enable Avoidance using ADSB;0:Disabled,1:Enabled
58;BARO_ALT_OFFSET;Enable Avoidance using ADSB;0:Disabled,1:Enabled
59;BARO_EXT_BUS;Enable Avoidance using ADSB;0:Disabled,1:Enabled
60;BARO_FIELD_ELV;Enable Avoidance using ADSB;0:Disabled,1:Enabled
61;BARO_FLTR_RNG;Enable Avoidance using ADSB;0:Disabled,1:Enabled
62;BARO_GND_TEMP;Enable Avoidance using ADSB;0:Disabled,1:Enabled
63;BARO_OPTIONS;Enable Avoidance using ADSB;0:Disabled,1:Enabled
64;BARO_PRIMARY;Enable Avoidance using ADSB;0:Disabled,1:Enabled
65;BARO_PROBE_EXT;Enable Avoidance using ADSB;0:Disabled,1:Enabled
66;BATT2_MONITOR;Controls enabling monitoring of the battery's voltage and current;0:Disabled,3:Analog Voltage Only,4:Analog Voltage and Current,5:Solo,6:Bebop,7:SMBus-Generic,8:UAVCAN-BatteryInfo,9:BLHeli ESC,10:SumOfFollowing,11:FuelFlow,12:FuelLevelPWM,13:SMBUS-SUI3,14:SMBUS-SUI6,15:NeoDesign,16:SMBus-Maxell
67;BATT3_MONITOR;Controls enabling monitoring of the battery's voltage and current;0:Disabled,3:Analog Voltage Only,4:Analog Voltage and Current,5:Solo,6:Bebop,7:SMBus-Generic,8:UAVCAN-BatteryInfo,9:BLHeli ESC,10:SumOfFollowing,11:FuelFlow,12:FuelLevelPWM,13:SMBUS-SUI3,14:SMBUS-SUI6,15:NeoDesign,16:SMBus-Maxell
68;BATT4_MONITOR;Controls enabling monitoring of the battery's voltage and current;0:Disabled,3:Analog Voltage Only,4:Analog Voltage and Current,5:Solo,6:Bebop,7:SMBus-Generic,8:UAVCAN-BatteryInfo,9:BLHeli ESC,10:SumOfFollowing,11:FuelFlow,12:FuelLevelPWM,13:SMBUS-SUI3,14:SMBUS-SUI6,15:NeoDesign,16:SMBus-Maxell
69;BATT5_MONITOR;Controls enabling monitoring of the battery's voltage and current;0:Disabled,3:Analog Voltage Only,4:Analog Voltage and Current,5:Solo,6:Bebop,7:SMBus-Generic,8:UAVCAN-BatteryInfo,9:BLHeli ESC,10:SumOfFollowing,11:FuelFlow,12:FuelLevelPWM,13:SMBUS-SUI3,14:SMBUS-SUI6,15:NeoDesign,16:SMBus-Maxell
70;BATT6_MONITOR;Controls enabling monitoring of the battery's voltage and current;0:Disabled,3:Analog Voltage Only,4:Analog Voltage and Current,5:Solo,6:Bebop,7:SMBus-Generic,8:UAVCAN-BatteryInfo,9:BLHeli ESC,10:SumOfFollowing,11:FuelFlow,12:FuelLevelPWM,13:SMBUS-SUI3,14:SMBUS-SUI6,15:NeoDesign,16:SMBus-Maxell
71;BATT7_MONITOR;Controls enabling monitoring of the battery's voltage and current;0:Disabled,3:Analog Voltage Only,4:Analog Voltage and Current,5:Solo,6:Bebop,7:SMBus-Generic,8:UAVCAN-BatteryInfo,9:BLHeli ESC,10:SumOfFollowing,11:FuelFlow,12:FuelLevelPWM,13:SMBUS-SUI3,14:SMBUS-SUI6,15:NeoDesign,16:SMBus-Maxell
72;BATT8_MONITOR;Controls enabling monitoring of the battery's voltage and current;0:Disabled,3:Analog Voltage Only,4:Analog Voltage and Current,5:Solo,6:Bebop,7:SMBus-Generic,8:UAVCAN-BatteryInfo,9:BLHeli ESC,10:SumOfFollowing,11:FuelFlow,12:FuelLevelPWM,13:SMBUS-SUI3,14:SMBUS-SUI6,15:NeoDesign,16:SMBus-Maxell
73;BATT9_MONITOR;Controls enabling monitoring of the battery's voltage and current;0:Disabled,3:Analog Voltage Only,4:Analog Voltage and Current,5:Solo,6:Bebop,7:SMBus-Generic,8:UAVCAN-BatteryInfo,9:BLHeli ESC,10:SumOfFollowing,11:FuelFlow,12:FuelLevelPWM,13:SMBUS-SUI3,14:SMBUS-SUI6,15:NeoDesign,16:SMBus-Maxell
74;BATT_MONITOR;Controls enabling monitoring of the battery's voltage and current;0:Disabled,3:Analog Voltage Only,4:Analog Voltage and Current,5:Solo,6:Bebop,7:SMBus-Generic,8:UAVCAN-BatteryInfo,9:BLHeli ESC,10:SumOfFollowing,11:FuelFlow,12:FuelLevelPWM,13:SMBUS-SUI3,14:SMBUS-SUI6,15:NeoDesign,16:SMBus-Maxell
75;BRD_BOOT_DELAY;This adds a delay in milliseconds to boot to ensure peripherals initialise fully;
76;BRD_HEAT_I;This adds a delay in milliseconds to boot to ensure peripherals initialise fully;
77;BRD_HEAT_IMAX;This adds a delay in milliseconds to boot to ensure peripherals initialise fully;
78;BRD_HEAT_LOWMGN;This adds a delay in milliseconds to boot to ensure peripherals initialise fully;
79;BRD_HEAT_P;This adds a delay in milliseconds to boot to ensure peripherals initialise fully;
80;BRD_HEAT_TARG;This adds a delay in milliseconds to boot to ensure peripherals initialise fully;
81;BRD_IO_ENABLE;This allows for the IO co-processor on FMUv1 and FMUv2 to be disabled;0:Disabled,1:Enabled
82;BRD_OPTIONS;Board specific option flags;
83;BRD_RTC_TYPES;Specifies which sources of UTC time will be accepted;
84;BRD_RTC_TZ_MIN;Adds offset in +- minutes from UTC to calculate local time;
85;BRD_SAFETYENABLE;This controls the default state of the safety switch at startup. When set to 1 the safety switch will start in the safe state (flashing) at boot. When set to zero the safety switch will start in the unsafe state (solid) at startup. Note that if a safety switch is fitted the user can still control the safety state after startup using the switch. The safety state can also be controlled in software using a MAVLink message.;0:Disabled,1:Enabled
86;BRD_SAFETYOPTION;This controls the activation of the safety button. It allows you to control if the safety button can be used for safety enable and/or disable, and whether the button is only active when disarmed;
87;BRD_SAFETY_MASK;A bitmask which controls what outputs can move while the safety switch has not been pressed;0:Disabled,1:Enabled
88;BRD_SBUS_OUT;This sets the SBUS output frame rate in Hz;0:Disabled,1:50Hz,2:75Hz,3:100Hz,4:150Hz,5:200Hz,6:250Hz,7:300Hz
89;BRD_SD_SLOWDOWN;This is a scaling factor to slow down microSD operation. It can be used on flight board and microSD card combinations where full speed is not reliable. For normal full speed operation a value of 0 should be used.;
90;BRD_SER1_RTSCTS;Enable flow control on serial 1 (telemetry 1) on Pixhawk. You must have the RTS and CTS pins connected to your radio. The standard DF13 6 pin connector for a 3DR radio does have those pins connected. If this is set to 2 then flow control will be auto-detected by checking for the output buffer filling on startup. Note that the PX4v1 does not have hardware flow control pins on this port, so you should leave this disabled.;0:Disabled,1:Enabled,2:Auto
91;BRD_SER2_RTSCTS;Enable flow control on serial 2 (telemetry 2) on Pixhawk and STATE. You must have the RTS and CTS pins connected to your radio. The standard DF13 6 pin connector for a 3DR radio does have those pins connected. If this is set to 2 then flow control will be auto-detected by checking for the output buffer filling on startup.;0:Disabled,1:Enabled,2:Auto
92;BRD_SERIAL_NUM;User-defined serial number of this vehicle, it can be any arbitrary number you want and has no effect on the autopilot;
93;BRD_TYPE;This allows selection of a PX4 or VRBRAIN board type. If set to zero then the board type is auto-detected (PX4);0:AUTO,1:PX4V1,2:Pixhawk,3:Cube/Pixhawk2,4:Pixracer,5:PixhawkMini,6:Pixhawk2Slim,7:VRBrain 5.1,8:VRBrain 5.2,9:VR Micro Brain 5.1,10:VR Micro Brain 5.2,11:VRBrain Core 1.0,12:VRBrain 5.4,13:Intel Aero FC,20:AUAV2.1
94;BRD_VBUS_MIN;Minimum voltage on the autopilot power rail to allow the aircraft to arm. 0 to disable the check.;
95;BRD_VSERVO_MIN;Minimum voltage on the servo rail to allow the aircraft to arm. 0 to disable the check.;
96;BTN_ENABLE;This enables the button checking module. When this is disabled the parameters for setting button inputs are not visible;0:Disabled, 1:Enabled
97;CAM_AUTO_ONLY;When enabled, trigging by distance is done in AUTO mode only.;0:Always,1:Only when in AUTO
98;CAM_DURATION;How long the shutter will be held open in 10ths of a second (i.e. enter 10 for 1second, 50 for 5seconds);
99;CAM_FEEDBACK_PIN;pin number to use for save accurate camera feedback messages. If set to -1 then don't use a pin flag for this, otherwise this is a pin number which if held high after a picture trigger order, will save camera messages when camera really takes a picture. A universal camera hot shoe is needed. The pin should be held high for at least 2 milliseconds for reliable trigger detection. See also the CAM_FEEDBACK_POL option.;-1:Disabled,50:AUX1,51:AUX2,52:AUX3,53:AUX4,54:AUX5,55:AUX6
100;CAM_FEEDBACK_POL;;-1:Disabled,50:AUX1,51:AUX2,52:AUX3,53:AUX4,54:AUX5,55:AUX6
101;CAM_MAX_ROLL;Postpone shooting if roll is greater than limit. (0=Disable, will shoot regardless of roll).;
102;CAM_MIN_INTERVAL;Postpone shooting if previous picture was taken less than preset time(ms) ago.;
103;CAM_RC_TYPE;Postpone shooting if previous picture was taken less than preset time(ms) ago.;
104;CAM_RELAY_ON;This sets whether the relay goes high or low when it triggers. Note that you should also set RELAY_DEFAULT appropriately for your camera;0:Low,1:High
105;CAM_SERVO_OFF;PWM value in microseconds to move servo to when shutter is deactivated;
106;CAM_SERVO_ON;PWM value in microseconds to move servo to when shutter is activated;
107;CAM_TRIGG_DIST;Distance in meters between camera triggers. If this value is non-zero then the camera will trigger whenever the position changes by this number of meters regardless of what mode the APM is in. Note that this parameter can also be set in an auto mission using the DO_SET_CAM_TRIGG_DIST command, allowing you to enable/disable the triggering of the camera during the flight.;
108;CAM_TRIGG_TYPE;how to trigger the camera to take a picture;0:Servo,1:Relay, 2:GoPro in Solo Gimbal
109;CAM_TYPE;Set the camera type that is being used, certain cameras have custom functions that need further configuration, this enables that.;0:Default,1:BMMCC
110;CAN_D1_PROTOCOL;Enabling this option starts selected protocol that will use this virtual driver;0:Disabled,1:UAVCAN,2:KDECAN,3:ToshibaCAN,4:PiccoloCAN,5:CANTester
111;CAN_D2_PROTOCOL;Enabling this option starts selected protocol that will use this virtual driver;0:Disabled,1:UAVCAN,2:KDECAN,3:ToshibaCAN,4:PiccoloCAN,5:CANTester
112;CAN_LOGLEVEL;Loglevel for recording initialisation and debug information from CAN Interface;0: Log None, 1: Log Error, 2: Log Warning and below, 3: Log Info and below, 4: Log Everything
113;CAN_P1_DRIVER;Enabling this option enables use of CAN buses.;0:Disabled,1:First driver,2:Second driver
114;CAN_P2_DRIVER;Enabling this option enables use of CAN buses.;0:Disabled,1:First driver,2:Second driver
115;CAN_SLCAN_CPORT;CAN Interface ID to be routed to SLCAN, 0 means no routing;0:Disabled,1:First interface,2:Second interface
116;CAN_SLCAN_SDELAY;Duration after which slcan starts after setting SERNUM in seconds.;
117;CAN_SLCAN_SERNUM;Serial Port ID to be used for temporary SLCAN iface, -1 means no temporary serial. This parameter is automatically reset on reboot or on timeout. See CAN_SLCAN_TIMOUT for timeout details;-1:Disabled,0:Serial0,1:Serial1,2:Serial2,3:Serial3,4:Serial4,5:Serial5,6:Serial6
118;CAN_SLCAN_TIMOUT;;-1:Disabled,0:Serial0,1:Serial1,2:Serial2,3:Serial3,4:Serial4,5:Serial5,6:Serial6
119;CHUTE_ENABLED;Parachute release enabled or disabled;0:Disabled,1:Enabled
120;COMPASS_AUTODEC;Enable or disable the automatic calculation of the declination based on gps location;0:Disabled,1:Enabled
121;COMPASS_AUTO_ROT;When enabled this will automatically check the orientation of compasses on successful completion of compass calibration. If set to 2 then external compasses will have their orientation automatically corrected.;0:Disabled,1:CheckOnly,2:CheckAndFix
122;COMPASS_CAL_FIT;This controls the fitness level required for a successful compass calibration. A lower value makes for a stricter fit (less likely to pass). This is the value used for the primary magnetometer. Other magnetometers get double the value.;4:Very Strict,8:Strict,16:Default,32:Relaxed
123;COMPASS_DEC;An angle to compensate between the true north and magnetic north;
124;COMPASS_DEV_ID;Compass device id.  Automatically detected, do not set manually;
125;COMPASS_DEV_ID2;Second compass's device id.  Automatically detected, do not set manually;
126;COMPASS_DEV_ID3;Third compass's device id.  Automatically detected, do not set manually;
127;COMPASS_DEV_ID4;Extra 4th compass's device id.  Automatically detected, do not set manually;
128;COMPASS_DEV_ID5;Extra 5th compass's device id.  Automatically detected, do not set manually;
129;COMPASS_DEV_ID6;Extra 6th compass's device id.  Automatically detected, do not set manually;
130;COMPASS_DEV_ID7;Extra 7th compass's device id.  Automatically detected, do not set manually;
131;COMPASS_DEV_ID8;Extra 8th compass's device id.  Automatically detected, do not set manually;
132;COMPASS_DIA2_X;DIA_X in the compass2 soft-iron calibration matrix: [[DIA_X, ODI_X, ODI_Y], [ODI_X, DIA_Y, ODI_Z], [ODI_Y, ODI_Z, DIA_Z]];
133;COMPASS_DIA2_Y;DIA_Y in the compass2 soft-iron calibration matrix: [[DIA_X, ODI_X, ODI_Y], [ODI_X, DIA_Y, ODI_Z], [ODI_Y, ODI_Z, DIA_Z]];
134;COMPASS_DIA2_Z;DIA_Z in the compass2 soft-iron calibration matrix: [[DIA_X, ODI_X, ODI_Y], [ODI_X, DIA_Y, ODI_Z], [ODI_Y, ODI_Z, DIA_Z]];
135;COMPASS_DIA3_X;DIA_X in the compass3 soft-iron calibration matrix: [[DIA_X, ODI_X, ODI_Y], [ODI_X, DIA_Y, ODI_Z], [ODI_Y, ODI_Z, DIA_Z]];
136;COMPASS_DIA3_Y;DIA_Y in the compass3 soft-iron calibration matrix: [[DIA_X, ODI_X, ODI_Y], [ODI_X, DIA_Y, ODI_Z], [ODI_Y, ODI_Z, DIA_Z]];
137;COMPASS_DIA3_Z;DIA_Z in the compass3 soft-iron calibration matrix: [[DIA_X, ODI_X, ODI_Y], [ODI_X, DIA_Y, ODI_Z], [ODI_Y, ODI_Z, DIA_Z]];
138;COMPASS_DIA_X;DIA_X in the compass soft-iron calibration matrix: [[DIA_X, ODI_X, ODI_Y], [ODI_X, DIA_Y, ODI_Z], [ODI_Y, ODI_Z, DIA_Z]];
139;COMPASS_DIA_Y;DIA_Y in the compass soft-iron calibration matrix: [[DIA_X, ODI_X, ODI_Y], [ODI_X, DIA_Y, ODI_Z], [ODI_Y, ODI_Z, DIA_Z]];
140;COMPASS_DIA_Z;DIA_Z in the compass soft-iron calibration matrix: [[DIA_X, ODI_X, ODI_Y], [ODI_X, DIA_Y, ODI_Z], [ODI_Y, ODI_Z, DIA_Z]];
141;COMPASS_ENABLE;Setting this to Enabled(1) will enable the compass. Setting this to Disabled(0) will disable the compass. Note that this is separate from COMPASS_USE. This will enable the low level senor, and will enable logging of magnetometer data. To use the compass for navigation you must also set COMPASS_USE to 1.;0:Disabled,1:Enabled
142;COMPASS_EXTERN2;Configure second compass so it is attached externally. This is auto-detected on PX4 and Pixhawk. If set to 0 or 1 then auto-detection by bus connection can override the value. If set to 2 then auto-detection will be disabled.;0:Internal,1:External,2:ForcedExternal
143;COMPASS_EXTERN3;Configure third compass so it is attached externally. This is auto-detected on PX4 and Pixhawk. If set to 0 or 1 then auto-detection by bus connection can override the value. If set to 2 then auto-detection will be disabled.;0:Internal,1:External,2:ForcedExternal
144;COMPASS_EXTERNAL;Configure third compass so it is attached externally. This is auto-detected on PX4 and Pixhawk. If set to 0 or 1 then auto-detection by bus connection can override the value. If set to 2 then auto-detection will be disabled.;0:Internal,1:External,2:ForcedExternal
145;COMPASS_FLTR_RNG;This sets the range around the average value that new samples must be within to be accepted. This can help reduce the impact of noise on sensors that are on long I2C cables. The value is a percentage from the average value. A value of zero disables this filter.;
146;COMPASS_LEARN;Enable or disable the automatic learning of compass offsets. You can enable learning either using a compass-only method that is suitable only for fixed wing aircraft or using the offsets learnt by the active EKF state estimator. If this option is enabled then the learnt offsets are saved when you disarm the vehicle. If InFlight learning is enabled then the compass with automatically start learning once a flight starts (must be armed). While InFlight learning is running you cannot use position control modes.;0:Disabled,1:Internal-Learning,2:EKF-Learning,3:InFlight-Learning
